,initial_Generator,initial_Dificultate,initial_Capitole Principale,initial_Capitole Asociate,initial_user_input,initial_reference,initial_Evaluare Professor,initial_Unde se afla raspunsul,initial_retrieved_contexts,initial_response,user_input,retrieved_contexts,response,reference,context_precision,context_recall,answer_relevancy,faithfulness,bleu_score,rouge_score,factual_correctness
0,O3mini-high,LOW,C1,,"În contextul noțiunilor introductive, ce model de organizare a datelor este prezentat ca predominant în curs?",relațional,,,"['1. ', 'copyright@www.adrian.runceanu.ro\nIntroducere\n➢Pentru o bună înţelegere a noţiunilor teoretice şi \npractice prezentate în acest curs, este necesară \nparcurgerea anterioară a disciplinelor Programarea \ncalculatoarelor, Proiectarea algoritmilor si \nProgramare orientate pe obiecte.\n➢Cursul de Baze de date este structurat în 13 cursuri \n(capitole), fiecare dintre acestea cuprinzând câte \nun număr de 13 laboratoare (activităţi practice) la \ncare prezenţa va fi obligatorie.\nCurs - Baze de date 12', '\n', '2. ', 'copyright@www.adrian.runceanu.ro\nSubcereri corelate \n• O subinterogare corelata este o subinterogare \ncare se executa o data pentru fiecare linie \nconsiderata de interogarea principala si care la \nexecutie foloseste o valoare dintr-o coloana \ndin interogarea exterioara.\n• Ea se poate identifica prin folosirea unei \ncoloane a interogarii exterioare in clauza \noperatorului interogarii interioare. \nCurs 6 - BAZE DE DATE 56', '\n', '3. ', 'copyright@www.adrian.runceanu.ro\nVederile se folosesc pentru că oferă: \n1. Acces restricţionat la date (vederile pot \nselecţiona anumite coloane dintr-o tabelă)\n2. Posibilitatea lucrului cu interogări complexe\n3. Independenţa datelor\n4. Posibilitatea prezentării de date identice în \nvederi diferite\nCurs - BAZE DE DATE 5', '\n', '4. ', 'copyright@www.adrian.runceanu.ro\nCurs 1 \nNoţiuni introductive \ndespre \nteoria generală a bazelor de date\nCurs - Baze de date 2', '\n', '5. ', 'copyright@www.adrian.runceanu.ro\n1.2.Modelul de date relaţional\nO cheie candidat a unei relaţii R este o mulţime \nminimă de atribute de care toate celelalte atribute ale \nlui R sunt dependente funcţional. \nCheia primară a unei relaţii R este una din cheile \ncandidat care a fost desemnată în acest scop.\nO cheie străină a unei relaţii R este o mulţime de \natribute din schema relaţională care formează o cheie \nprimară pentru o altă relaţie. \nCurs - Baze de date\nCODSTUD NUMEPREN AN FACULTATE GRUPA MEDADM\n101 Popa Ionel 4 Inginerie 145 10.00\n102 Popescu Vasile 1 Drept 113 9.24\n103 Badea George 1 Inginerie 112 8.79\n104 Achim Mimi 2 Economic 126 9.31\n105 Ionescu Mioara 3 Litere 132 10.00 42', '\n']","Modelul de date relaţional.
","În contextul noțiunilor introductive, ce model de organizare a datelor este prezentat ca predominant în curs?","['1. ', 'copyright@www.adrian.runceanu.ro\nIntroducere\n➢Pentru o bună înţelegere a noţiunilor teoretice şi \npractice prezentate în acest curs, este necesară \nparcurgerea anterioară a disciplinelor Programarea \ncalculatoarelor, Proiectarea algoritmilor si \nProgramare orientate pe obiecte.\n➢Cursul de Baze de date este structurat în 13 cursuri \n(capitole), fiecare dintre acestea cuprinzând câte \nun număr de 13 laboratoare (activităţi practice) la \ncare prezenţa va fi obligatorie.\nCurs - Baze de date 12', '\n', '2. ', 'copyright@www.adrian.runceanu.ro\nSubcereri corelate \n• O subinterogare corelata este o subinterogare \ncare se executa o data pentru fiecare linie \nconsiderata de interogarea principala si care la \nexecutie foloseste o valoare dintr-o coloana \ndin interogarea exterioara.\n• Ea se poate identifica prin folosirea unei \ncoloane a interogarii exterioare in clauza \noperatorului interogarii interioare. \nCurs 6 - BAZE DE DATE 56', '\n', '3. ', 'copyright@www.adrian.runceanu.ro\nVederile se folosesc pentru că oferă: \n1. Acces restricţionat la date (vederile pot \nselecţiona anumite coloane dintr-o tabelă)\n2. Posibilitatea lucrului cu interogări complexe\n3. Independenţa datelor\n4. Posibilitatea prezentării de date identice în \nvederi diferite\nCurs - BAZE DE DATE 5', '\n', '4. ', 'copyright@www.adrian.runceanu.ro\nCurs 1 \nNoţiuni introductive \ndespre \nteoria generală a bazelor de date\nCurs - Baze de date 2', '\n', '5. ', 'copyright@www.adrian.runceanu.ro\n1.2.Modelul de date relaţional\nO cheie candidat a unei relaţii R este o mulţime \nminimă de atribute de care toate celelalte atribute ale \nlui R sunt dependente funcţional. \nCheia primară a unei relaţii R este una din cheile \ncandidat care a fost desemnată în acest scop.\nO cheie străină a unei relaţii R este o mulţime de \natribute din schema relaţională care formează o cheie \nprimară pentru o altă relaţie. \nCurs - Baze de date\nCODSTUD NUMEPREN AN FACULTATE GRUPA MEDADM\n101 Popa Ionel 4 Inginerie 145 10.00\n102 Popescu Vasile 1 Drept 113 9.24\n103 Badea George 1 Inginerie 112 8.79\n104 Achim Mimi 2 Economic 126 9.31\n105 Ionescu Mioara 3 Litere 132 10.00 42', '\n']","Modelul de date relaţional.
",relațional,0.07142857142142857,1.0,0.8174202388905467,0.0,0.0,0.5714285714285715,0.0
1,O3mini-high,LOW,C2,,Ce limbaj integrat în Oracle este utilizat pentru scrierea procedurilor stocate?,PL/SQL,,,"['1. ', 'copyright@www.adrian.runceanu.ro\n2.1. EVOLUŢIA ŞI FACILITĂŢILE SISTEMULUI ORACLE\nÎncepând cu versiunea 5.0 SGBD Oracle are \nurmătoarele facilităţi suplimentare: \n- funcţionează în arhitectura client/server\n- are limbaj procedural propriu PL/SQL\n- are precompilatoare ca interfaţă cu limbajele \nuniversale\n7Curs - Baze de date', '\n', '2. ', '2.4. ORACLE Database 11g Expres Edition\nPas 2: La un moment se va solicita introducerea unei parole \npentru utilizatorul SYS si pentru SYSTEM. Aceasta trebuie \nretinuta pentru a putea fi utilizata ulterior.\n43Curs - Baze de date', '\n', '3. ', 'copyright@www.adrian.runceanu.ro\n2.1. EVOLUŢIA ŞI FACILITĂŢILE SISTEMULUI ORACLE\n• Oferă facilităţi din tehnologia OO, prin care se permite \ndefinirea şi utilizarea de obiecte mari şi complexe\n• Optimizează cererile de regăsire prin reutilizarea \ncomenzilor SQL identice lansate de utilizatori diferiţi şi \nprin realizarea unui plan de execuţie a instrucţiunilor \nSQL\n• Are un grad de securitate sporit prin: \n– server de criptare\n– control trafic reţea\n– niveluri de parolare, etc.\n11Curs - Baze de date\nSGBD Oracle 8i (continuare)', '\n', '4. ', 'copyright@www.adrian.runceanu.ro\n2.1. EVOLUŢIA ŞI FACILITĂŢILE SISTEMULUI ORACLE\n• Are facilităţi de salvare/restaurare automate şi \ninteligente\n• Permite partiţionarea integrală pentru tabele şi indecşi\n• Are mesagerie integrală, prin comunicarea între \naplicaţii şi procesare offline (chiar dacă aplicaţiile nu \nsunt conectate)\n• Prelucrarea paralelă pentru: \n– replicare\n– cereri de regăsire\n– actualizare\n10Curs - Baze de date\nSGBD Oracle 8i (continuare)', '\n', '5. ', 'copyright@www.adrian.runceanu.ro\n2.2. Arhitectura SGBD-ului ORACLE\n3. Instrumentele sunt componente destinate \nîntreţinerii şi bunei funcţionări a unei BD Oracle. \nENTERPRISE MANAGER CONSOLE conţine mai multe \nutilitare destinate administratorului BD:\n- deschidere / închidere BD\n- autorizarea accesului\n- refacerea BD\n- conversii de date\n31Curs - Baze de date', '\n']","limbajul procedural propriu SGBD Oracle este PL/SQL.
",Ce limbaj integrat în Oracle este utilizat pentru scrierea procedurilor stocate?,"['1. ', 'copyright@www.adrian.runceanu.ro\n2.1. EVOLUŢIA ŞI FACILITĂŢILE SISTEMULUI ORACLE\nÎncepând cu versiunea 5.0 SGBD Oracle are \nurmătoarele facilităţi suplimentare: \n- funcţionează în arhitectura client/server\n- are limbaj procedural propriu PL/SQL\n- are precompilatoare ca interfaţă cu limbajele \nuniversale\n7Curs - Baze de date', '\n', '2. ', '2.4. ORACLE Database 11g Expres Edition\nPas 2: La un moment se va solicita introducerea unei parole \npentru utilizatorul SYS si pentru SYSTEM. Aceasta trebuie \nretinuta pentru a putea fi utilizata ulterior.\n43Curs - Baze de date', '\n', '3. ', 'copyright@www.adrian.runceanu.ro\n2.1. EVOLUŢIA ŞI FACILITĂŢILE SISTEMULUI ORACLE\n• Oferă facilităţi din tehnologia OO, prin care se permite \ndefinirea şi utilizarea de obiecte mari şi complexe\n• Optimizează cererile de regăsire prin reutilizarea \ncomenzilor SQL identice lansate de utilizatori diferiţi şi \nprin realizarea unui plan de execuţie a instrucţiunilor \nSQL\n• Are un grad de securitate sporit prin: \n– server de criptare\n– control trafic reţea\n– niveluri de parolare, etc.\n11Curs - Baze de date\nSGBD Oracle 8i (continuare)', '\n', '4. ', 'copyright@www.adrian.runceanu.ro\n2.1. EVOLUŢIA ŞI FACILITĂŢILE SISTEMULUI ORACLE\n• Are facilităţi de salvare/restaurare automate şi \ninteligente\n• Permite partiţionarea integrală pentru tabele şi indecşi\n• Are mesagerie integrală, prin comunicarea între \naplicaţii şi procesare offline (chiar dacă aplicaţiile nu \nsunt conectate)\n• Prelucrarea paralelă pentru: \n– replicare\n– cereri de regăsire\n– actualizare\n10Curs - Baze de date\nSGBD Oracle 8i (continuare)', '\n', '5. ', 'copyright@www.adrian.runceanu.ro\n2.2. Arhitectura SGBD-ului ORACLE\n3. Instrumentele sunt componente destinate \nîntreţinerii şi bunei funcţionări a unei BD Oracle. \nENTERPRISE MANAGER CONSOLE conţine mai multe \nutilitare destinate administratorului BD:\n- deschidere / închidere BD\n- autorizarea accesului\n- refacerea BD\n- conversii de date\n31Curs - Baze de date', '\n']","limbajul procedural propriu SGBD Oracle este PL/SQL.
",PL/SQL,0.49999999995,1.0,0.8438575121719675,1.0,0.15619699684601282,0.4,0.0
