,initial_Generator,initial_Dificultate,initial_Capitole Principale,initial_Capitole Asociate,initial_user_input,initial_reference,initial_Evaluare Professor,initial_Unde se afla raspunsul,initial_retrieved_contexts,initial_response,user_input,retrieved_contexts,response,reference,context_precision,context_recall,answer_relevancy,faithfulness,bleu_score,rouge_score,factual_correctness
0,O3mini-high,LOW,C1,,"În contextul noțiunilor introductive, ce model de organizare a datelor este prezentat ca predominant în curs?",relațional,Este corect,,"['1. ', 'copyright@www.adrian.runceanu.ro\nIntroducere\n➢Pentru o bună înţelegere a noţiunilor teoretice şi \npractice prezentate în acest curs, este necesară \nparcurgerea anterioară a disciplinelor Programarea \ncalculatoarelor, Proiectarea algoritmilor si \nProgramare orientate pe obiecte.\n➢Cursul de Baze de date este structurat în 13 cursuri \n(capitole), fiecare dintre acestea cuprinzând câte \nun număr de 13 laboratoare (activităţi practice) la \ncare prezenţa va fi obligatorie.\nCurs - Baze de date 12', '\n', '2. ', 'copyright@www.adrian.runceanu.ro\nSubcereri corelate \n• O subinterogare corelata este o subinterogare \ncare se executa o data pentru fiecare linie \nconsiderata de interogarea principala si care la \nexecutie foloseste o valoare dintr-o coloana \ndin interogarea exterioara.\n• Ea se poate identifica prin folosirea unei \ncoloane a interogarii exterioare in clauza \noperatorului interogarii interioare. \nCurs 6 - BAZE DE DATE 56', '\n', '3. ', 'copyright@www.adrian.runceanu.ro\nVederile se folosesc pentru că oferă: \n1. Acces restricţionat la date (vederile pot \nselecţiona anumite coloane dintr-o tabelă)\n2. Posibilitatea lucrului cu interogări complexe\n3. Independenţa datelor\n4. Posibilitatea prezentării de date identice în \nvederi diferite\nCurs - BAZE DE DATE 5', '\n', '4. ', 'copyright@www.adrian.runceanu.ro\nCurs 1 \nNoţiuni introductive \ndespre \nteoria generală a bazelor de date\nCurs - Baze de date 2', '\n', '5. ', 'copyright@www.adrian.runceanu.ro\n1.2.Modelul de date relaţional\nO cheie candidat a unei relaţii R este o mulţime \nminimă de atribute de care toate celelalte atribute ale \nlui R sunt dependente funcţional. \nCheia primară a unei relaţii R este una din cheile \ncandidat care a fost desemnată în acest scop.\nO cheie străină a unei relaţii R este o mulţime de \natribute din schema relaţională care formează o cheie \nprimară pentru o altă relaţie. \nCurs - Baze de date\nCODSTUD NUMEPREN AN FACULTATE GRUPA MEDADM\n101 Popa Ionel 4 Inginerie 145 10.00\n102 Popescu Vasile 1 Drept 113 9.24\n103 Badea George 1 Inginerie 112 8.79\n104 Achim Mimi 2 Economic 126 9.31\n105 Ionescu Mioara 3 Litere 132 10.00 42', '\n']","1.2.Modelul de date relaţional.
","În contextul noțiunilor introductive, ce model de organizare a datelor este prezentat ca predominant în curs?","['1. ', 'copyright@www.adrian.runceanu.ro\nIntroducere\n➢Pentru o bună înţelegere a noţiunilor teoretice şi \npractice prezentate în acest curs, este necesară \nparcurgerea anterioară a disciplinelor Programarea \ncalculatoarelor, Proiectarea algoritmilor si \nProgramare orientate pe obiecte.\n➢Cursul de Baze de date este structurat în 13 cursuri \n(capitole), fiecare dintre acestea cuprinzând câte \nun număr de 13 laboratoare (activităţi practice) la \ncare prezenţa va fi obligatorie.\nCurs - Baze de date 12', '\n', '2. ', 'copyright@www.adrian.runceanu.ro\nSubcereri corelate \n• O subinterogare corelata este o subinterogare \ncare se executa o data pentru fiecare linie \nconsiderata de interogarea principala si care la \nexecutie foloseste o valoare dintr-o coloana \ndin interogarea exterioara.\n• Ea se poate identifica prin folosirea unei \ncoloane a interogarii exterioare in clauza \noperatorului interogarii interioare. \nCurs 6 - BAZE DE DATE 56', '\n', '3. ', 'copyright@www.adrian.runceanu.ro\nVederile se folosesc pentru că oferă: \n1. Acces restricţionat la date (vederile pot \nselecţiona anumite coloane dintr-o tabelă)\n2. Posibilitatea lucrului cu interogări complexe\n3. Independenţa datelor\n4. Posibilitatea prezentării de date identice în \nvederi diferite\nCurs - BAZE DE DATE 5', '\n', '4. ', 'copyright@www.adrian.runceanu.ro\nCurs 1 \nNoţiuni introductive \ndespre \nteoria generală a bazelor de date\nCurs - Baze de date 2', '\n', '5. ', 'copyright@www.adrian.runceanu.ro\n1.2.Modelul de date relaţional\nO cheie candidat a unei relaţii R este o mulţime \nminimă de atribute de care toate celelalte atribute ale \nlui R sunt dependente funcţional. \nCheia primară a unei relaţii R este una din cheile \ncandidat care a fost desemnată în acest scop.\nO cheie străină a unei relaţii R este o mulţime de \natribute din schema relaţională care formează o cheie \nprimară pentru o altă relaţie. \nCurs - Baze de date\nCODSTUD NUMEPREN AN FACULTATE GRUPA MEDADM\n101 Popa Ionel 4 Inginerie 145 10.00\n102 Popescu Vasile 1 Drept 113 9.24\n103 Badea George 1 Inginerie 112 8.79\n104 Achim Mimi 2 Economic 126 9.31\n105 Ionescu Mioara 3 Litere 132 10.00 42', '\n']","1.2.Modelul de date relaţional.
",relațional,0.07142857142142857,1.0,0.8174202388905467,0.0,0.0,0.4444444444444445,0.0
